{
  "partner": {
    "id": "tradewithJohn",
    "name": "Trade With John",
    "email": "support@tradewithJohn.com",
    "website": "https://tradewithJohn.com",
    "social": {
      "youtube": "https://youtube.com/@tradewithJohn",
      "twitter": "https://twitter.com/tradewithJohn",
      "discord": "https://discord.gg/tradewithJohn"
    }
  },
  "extension": {
    "name": "TradeDeals by John",
    "short_name": "TradeDeals",
    "description": "John's exclusive prop firm discount finder - Save on FTMO, Apex & more!",
    "version": "1.0.0"
  },
  "branding": {
    "theme_name": "Trading Blue",
    "primary_color": "#3B82F6",
    "secondary_color": "#1E40AF",
    "accent_color": "#60A5FA",
    "logo_text": "TradeDeals",
    "tagline": "Save on prop firms with John"
  },
  "firms": [
    {
      "firm_id": "ftmo",
      "enabled": true,
      "affiliate_code": "JOHN15",
      "affiliate_url": "https://www.ftmo.com/?ref=tradewithJohn"
    },
    {
      "firm_id": "apex",
      "enabled": true,
      "affiliate_code": "JOHNAPEX10",
      "affiliate_url": "https://www.apextraderfunding.com/?ref=tradewithJohn"
    },
    {
      "firm_id": "topstep",
      "enabled": true,
      "affiliate_code": "JOHNTOP20",
      "affiliate_url": "https://www.topstepfx.com/?ref=tradewithJohn",
      "custom_discount": {
        "amount": 25,
        "description": "25% off first month - John's exclusive deal!",
        "expires_at": "2025-12-31T23:59:59Z"
      }
    },
    {
      "firm_id": "myfundedfutures",
      "enabled": false
    },
    {
      "firm_id": "the5ers",
      "enabled": false
    }
  ],
  "customization": {
    "welcome_message": "Welcome to TradeDeals! Thanks for supporting John's channel. You'll now automatically save on your prop firm purchases!",
    "footer_text": "Made with ❤️ by John for the trading community",
    "show_partner_branding": true,
    "custom_features": {
      "notifications_default": true,
      "show_expiration_countdown": true
    }
  },
  "monetization": {
    "model": "revenue_share",
    "platform_share": 0.30,
    "partner_share": 0.70
  },
  "generated": {
    "created_at": "2025-10-23T16:00:00Z",
    "updated_at": "2025-10-23T16:00:00Z",
    "build_version": "1.0.0"
  }
}
